{"assessment":{"assessment_id":"VTI-Eucalyptus","artifact_ref":"issue:960","schema_version":"rahp-assessment/v1","profile_id":"vti-clean-room","profile_version":"eucalyptus","release":"Eucalyptus"},"scope":{"directly_assessed":[{"component_id":"vti-release","resolved_ref":"eucalyptus","reason":"Coordinated Eucalyptus release target"},{"component_id":"vti-composition","resolved_ref":"eucalyptus","reason":"Composition boundary admitted by the campaign"}],"supporting_dependencies":[{"component_id":"rahp-toolkit","resolved_ref":"v2.7.0","treatment":"observed_not_assessed","limitations":["Assurance producer, not an independently assessed release component."]}],"excluded":[{"component_id":"transitive-components","reason":"Not independently assessed by dependency inclusion"}],"coverage_state":"partial","limitations":["Twenty propositions were admitted; substantive evidence gaps remain."]},"findings":[{"finding_id":"VTI-COMPOSITION","criteria_id":"composition-assurance","affected_components":["vti-release"],"claim_id":"composition","disposition":"indeterminate","evidence_refs":["issue:960#composition"]},{"finding_id":"VTI-PRIVACY","criteria_id":"privacy-assurance","affected_components":["vti-release"],"claim_id":"privacy","disposition":"indeterminate","evidence_refs":["issue:960#privacy"]},{"finding_id":"EUC-EVIDENCE-PRESERVATION","criteria_id":"evidence-preservation","affected_components":["vti-release"],"claim_id":"durable-evidence","disposition":"supported","lineage_state":"introduced","evidence_refs":["issue:960#sealed-evidence"]}],"comparison":{"comparison_id":"dogwood-to-eucalyptus","baseline_assessment_id":"VTI-Dogwood-RC-1","dimensions":[{"dimension_id":"assessment-capability","category":"assessment_process","comparability":"compatible","judgment":"materially_improved","confidence":"high","justification":"The candidate used a broader campaign with native follow-up and durable publication.","evidence_refs":["issue:253","issue:960"],"counterevidence_refs":[],"unresolved_limitations":[]},{"dimension_id":"evidence-preservation","category":"evidence","comparability":"compatible","judgment":"materially_improved","confidence":"high","justification":"The candidate preserved sealed campaign and native archives with integrity roots.","evidence_refs":["issue:253","issue:960#sealed-evidence"],"counterevidence_refs":[],"unresolved_limitations":[]},{"dimension_id":"composition-assurance","category":"assurance_outcome","comparability":"partial","judgment":"indeterminate","confidence":"high","justification":"No matched proposition set establishes whole-composition improvement.","evidence_refs":["issue:253#composition","issue:960#composition"],"counterevidence_refs":[],"unresolved_limitations":["Candidate composition propositions remain unclosed."]},{"dimension_id":"privacy-assurance","category":"assurance_outcome","comparability":"not_comparable","judgment":"not_comparable","confidence":"high","justification":"The two assessments use materially different privacy scope and propositions.","evidence_refs":["issue:253#privacy","issue:960#privacy"],"counterevidence_refs":[],"unresolved_limitations":["A common privacy-pressure profile has not been executed."]}],"recommendations":[{"action":"Execute matched privacy and composition propositions against both releases.","basis":["composition-assurance","privacy-assurance"],"normative":false}],"reassessment_triggers":["Completion of the matched Dogwood and Eucalyptus proposition set"]}}
